,platform_num,date,content
43,2,2021-10-09,"공주대가 더 좋아보입니다.!
그래도 상대적이라서 질문자님 상황에 맞게 비교해보시는게 좋을 듯 합니다. ㅎㅎ
질문자님께서 대학진학에 고민이신가요?
저는 질문자님께 학사편입제도라는 것을 추천드리고 싶습니다.
저도 학사편입으로 학교 진학 성공하였고 메리트있는 제도여서 강력히 추천드립니다.!
그냥 이런것도 있구나하고 봐주시면 될 것 같습니다. ㅎㅎ
제 이야기를 조금 말씀드리자면 저는 고3시절 공부보다 게임하는 걸 더 좋아하는 학생이었지만 지금은 홍익대 서울캠퍼스에 다니고 있습니다.
게임이 좋았던 저는 막상 고3이 되고 대학 진학을 하려다보니 너무 막막했고 결국 대학 진학에 실패하였습니다. 
저는 성적에 맞춰 가는 대학은 의미가 없다고 생각하여 
재수를 생각하고 있던 도중 주변인의 추천으로
동국대학교 듀이카 (제가다닐때는 동국대학교 전산원이였습니다.)라는 곳을 알게 되었습니다.
동국대 듀이카를 찾아보니 대학처럼 학과를 선택해서 전공과목도 배울수 있고
단기간에 4년제 졸업장을 따서 4년제 대학의 3학년으로 편입을 성공할 수 있도록 도와주는 기관이었고
저처럼 내신이나 수능성적이 좋지 않아도 면접100%선발하는 곳이라서 바로 지원하게 되었습니다.
저는 동국대 듀이카를 2년간 다니며 4년제 졸업장인 학사학위를 취득하고
학사편입으로 대학에 합격한 결과 수학 전교 꼴찌도 해본 저도 인서울 홍익대학교에 합격하였습니다.
저처럼 내신수능에 대한 기본기가 없던 학생도
동국대 듀이카에서 학사편입으로 인서울 갔었던 이유는 편입에 대한 이해를 잘 해보시면 길이 보일겁니다.
흔히 어렵다고 하는 편입이 일반편입입니다.
일반편입은 중하위권, 중상위권 대학 학생까지 지원을 많이 하기 때문에 커트라인과 경쟁률이 높습니다. 
하지만 학사편입의 경우 4년제 졸업한 사람만 지원이 가능한데..중상위권 4년제 대학을 졸업하고 또 편입을 하는 사람은 극히 드물기 때문에
일반편입과 비교했을 때 커트라인이 낮고 경쟁률 또한 낮습니다. (학사편입은 5~6등급 레벨 때의 학생들이 많이 지원합니다.) 
수시나 정시에 비해 학사편입의 장점이 많아 이를 활용하면 인서울 갈 수 있습니다.
편입은 과목수가 적다는 장점이 있습니다. 
저는 5~6등급의 학생이었습니다. 
만약 재수를 선택했다면 공부를 체계적으로 하지 못하던 저는 뭐부터 해야 할지, 
그리고 각 과목에 얼마나 시간 투자를 해야 할지에 대해 어려움을 겪었을 겁니다. 
하지만 편입의 경우 문과는 영어 한 과목, 이과는 수학, 영어 2과목으로 과목수로 인한 걱정은 확연히 줄었습니다. 그만큼 적은 과목에 집중할 수 있다는 거겠죠?
그리고 동국대 듀이카는 학사편입하기 전, 대학생활에 적응할 수 있는 시스템을 구축해두었습니다. 
서울 캠퍼스에 있는 부대시설(도서관, 식당 등)을 이용할 수 있습니다. 
동아리 활동과 스터디 활동을 통하여 대학 생활도 즐기실 수 있습니다. 
편입 후 적응하기도 훨씬 수월했습니다.
저도 5~6등급에 성적 맞춰가는 대학을 가야 되나 고민을 많이 했었지만 동국대 듀이카를 접한 후 인생이 많이 바뀐 것 같습니다. 
동국대 듀이카에서는 매년 수많은 학생들이 편입에 성공하여 자신 있게 진학자 명단을 공개하고 있습니다.    국립 공주대 산업공학과가 더 나아 보입니다 청주대가 더 좋아 보입니다.
=== 청주대 출신 대기업 CEO ===
박근희 삼성그룹 부회장, CJ그룹 부회장
이원준 롯데그룹 부회장
경청호 현대백화점그룹 총괄 부회장
박재영 현대그룹 현대로지엠 택배 대표이사 사장
윤영준 현대그룹 현대건설 대표이사 사장
전병찬 현대그룹 현대에버다임 대표이사 사장
차천수 GS그룹 GS건설 대표이사 부사장
오병건 KB국민지주 국민은행 부행장 부사장
윤승욱 신한금융지주 신한은행 부행장 신한정보 대표이사 사장
채희대 농협중앙회 농협보험 대표이사 사장 
김영국 KBS 본부장 
최용주 삼진제약 대표이사 사장
기타등등 청주대 출신 전현직 대기업 CEO가 몇 백 명에 이를 정도로 많습니다..."
44,2,2021-08-28,"4년제 대학이면 기사, 공모전, 대외활동 있으면 됩니다.
2년제면 산업기사, 공모전, 대외활동 있으면 됩니다.
기능사 필요 없습니다.
화이팅~!
대외활동 공모전사이트 입니다.
여기서 찾아보시면 될 것 같아요.
참고 하세요. ^^
위비티 https://www.wevity.com 공모전 대외활동 - 위비티
대학생 공모전 사이트 대외활동 서포터즈 블로그 기자단 모집 아이디어 마케팅 광고 일러스트 디자인 웹툰 만화 미술 사진 소설 문학 시 ucc 영상 시나리오 캘리그라피 창업 경진대회 IT 청소년 봉사활동 주부 체험단
www.wevity.com  안녕하세요. 누구나 함께하는 대회.공모전.대외활동 포털 콘테스트코리아입니다.
산공과이시면,
대회와 대외할동은 아래에 공유합니다.
산공과와 관련된 자격증은 익히 알고 있을 것 같은데요. 
기업 전반에 많이 쓰이는 품질관리가 도움이 될 것 같습니다.
대회는 
아래 카테고리에서 산공과와 관련된 키워드로 찾아 보시길 추천드립니다.
[대회.공모전] - [The 다양한 분야] - [산업.사회.창업] 카테고리
https://www.contestkorea.com/sub/list.php?int_gbn=1&Txt_bcode=030620007 대회, 콘테스트, 공모전, 대외활동, 서포터즈 - 콘테스트코리아 2021
대회, 콘테스트, 공모전, 대외활동, 서포터즈, 기자단, 체험, 봉사, 전시회, 문학, 네이밍, 아이디어, IT, 웹툰, 디자인, UCC, 블로거, 이벤트
www.contestkorea.com 대외활동도
아래 카테고리에서 산공과와 관련된 키워드로 찾아 보시길 추천드립니다.
[전체 대외활동 현황] 카테고리
https://www.contestkorea.com/sub/list.php?int_gbn=2 대회, 콘테스트, 공모전, 대외활동, 서포터즈 - 콘테스트코리아 2021
대회, 콘테스트, 공모전, 대외활동, 서포터즈, 기자단, 체험, 봉사, 전시회, 문학, 네이밍, 아이디어, IT, 웹툰, 디자인, UCC, 블로거, 이벤트
www.contestkorea.com 아래는 달력입니다.
월별, 년별로 한눈에 대회와 대외활동 현황을 볼 수 있습니다.
참조 바랍니다~
[달력] - [대회.공모전   ㅣ  대외활동] 카테고리
https://www.contestkorea.com/sub/calendar.php?int_gbn=1 대회, 콘테스트, 공모전, 대외활동, 서포터즈 - 콘테스트코리아 2021
대회, 콘테스트, 공모전, 대외활동, 서포터즈, 기자단, 체험, 봉사, 전시회, 문학, 네이밍, 아이디어, IT, 웹툰, 디자인, UCC, 블로거, 이벤트
www.contestkorea.com "
45,2,2020-09-10,"1. 필수 선택과목은 모르겠지만 공학계열이면 미적분은 필수입니다~!~!~!@~!
2. 미적을 들으세요~!~~@~! 산업경영공학과면 기하 필요 없답니다~!~!@~! 물리 할 때 조금 필요할지도 모르지만 고딩 때 등급 떨어지는 거 감안하면 그냥 미적 들으시는게 나을 듯~~!@!@!~~!@@~!"
46,2,2019-05-28,"안녕하세요. 수시전형 질문이신데...
울산대 산업공학과...
울산대식 4.3등급
작년 기준 3.6등급이기에..많이 부족합니다...
일반학교 평균 성적대이기에...울산대식으로 하면 좀 더 높습니다..
참고만 하시기 바랍니다."
47,2,2020-09-25,"선문대 산업경영공학과 기준으로 말씀드리면 수업은 공대 다른 학과에 비해서 쉽구요, 산업 안전이나 제조 품질, IT, 금융 등 다양한 분야로 취업이 잘 됩니다. 갈수 있는 곳이 많으니 취업률이 상당히 높아요~2019년 기준 80%대 정도..
특히 산업안전이라고 건설쪽으로 취업을 많이 나가는데, 현대건설, 대림산업, 삼성엔지니어링 같은데 가면 연봉이 대략 4000만원정도 부터 됩니다.
장학 프로그램이나 해외 연수 이런게 빵빵하구요 "
48,2,2021-09-28,"큐넷 자가진단이요
https://open.kakao.com/o/sQBDffzd 윤준쌤님의 오픈프로필
#학점은행제#사회복지사#보육교사#산업기사#기사#학은제#평생교육#대졸자전형#전대졸전형#대학원#학사#2021편입#인서울편입#심리학사#교육대학원#간호학과대졸자전형#간호학과#편입영어#공인영어#물리치료학과#치위생학과#
open.kakao.com  언제나 자신이 살아가면서 모든게 공부라고 생각이 되더라구요
남들은 하지않는 내가 하면 참 잘할거 같은 그런 직종을 선택하시는게 중요한거 같습니다
나에게 정말 잘 맞는 직업을 선택하시고 새롭게 연구하시고 노력해보세요
나만의 직업을 하나 가지고 있으면 정말 든든할거 같아요
요즘에는 과거와 다르게 새로운 자격증들이 많이 생겨나는거 같더라구요
자격증 선택의 기준을 무엇보다도 나 자신과 잘 맞는것인지 이런부분 확인해보시고 결정하세요
자격증 자료들 아래 종류별로 다양하게 신청하셔서 받아보시기 바래요
사회복지사 자격증 무료상담 받기 
http://m.site.naver.com/0Rj17
생활스포츠지도사 자격증 무료상담 받기 
http://m.site.naver.com/0RiZD
농산물 품질관리사 자격증 무료상담 받기 
http://m.site.naver.com/0Rj02
수산물 품질관리사 자격증 무료상담 받기 
http://m.site.naver.com/0Rj2g
심리상담사 자격증 무료상담 받기 
http://m.site.naver.com/0Rj16
반려동물관리사 자격증 무료상담 받기 
http://m.site.naver.com/0Rj3b
체형관리사 자격증 무료상담 받기 
http://m.site.naver.com/0Rj3n
간병사 자격증 무료상담 받기 
http://m.site.naver.com/0Rj2o
약용식물자원관리사 자격증 무료상담 받기 
http://m.site.naver.com/0RiZY
유치원행정실무사 자격증 무료상담 받기 
http://m.site.naver.com/0Rj1d
천연염색사 자격증 무료상담 받기 
http://m.site.naver.com/0Rj3C
토종식물해설사 자격증 무료상담 받기 
http://m.site.naver.com/0Rj2a
노인심리상담사 자격증 무료상담 받기 
http://m.site.naver.com/0Rj0g
베이비시터 자격증 무료상담 받기 
http://m.site.naver.com/0Rj2n
산지식물자원관리사 자격증 무료상담 받기 
http://m.site.naver.com/0Rj2V
식이지도사 자격증 무료상담 받기 
http://m.site.naver.com/0Rj28
노인스포츠지도사 자격증 무료상담 받기 
http://m.site.naver.com/0Rj1u
한자지도사 자격증 무료상담 받기 
http://m.site.naver.com/0Rj2t
산후관리사 자격증 무료상담 받기 
http://m.site.naver.com/0Rj3F"
49,2,2019-02-02,
