,platform_num,date,content
0,2,2021-11-19,"산업공학과 졸업생이이에요
멈춰!
당장 멈춰!
정말 쓸데없는 공부에요 미적분은
미적분의 ㅁ도 공부 안합니다.
1학년 때 공학인증 제도로 기본적인 수학을 할 수도 있는데 있으면 그때 가서 조금 해서 학점만 받아두세요
통계 공부 하세요 그게 훨씬 더 도움됩니다"
1,2,2021-12-11,"찾아보니 수학 경영 통계쪽을 배우는 것으로 보아 파이썬과 R프로그래밍을 배워서 빅 데이터 분야로 가는 것이 가장 나아보입니다. 여기로 가면 금융권이나 공기업, 사기업 등 여러 기관의 데이터베이스를 관리하는 것도 가능하게 되지요.
아니면 산업공학과에서도 코딩을 은근 취급하는만큼 웹 & 앱 개발에 관한 실무 능력을 키워서 웹 & 앱 개발자로 먼저 경력을 쌓은 다음에 기업의 데이터베이스 인력 채용으로 빠지는 것도 괜찮다고 생각합니다. KG ITBANK 맞춤상담센터
ssk.itbank.academy IT 진로, 취업, 교육 상담
#IT #진로 #진학 #취업 #IT교육 #코딩교육 #국비지원 #SW특기자전형 #정보올림피아드 #코드페어 #IT특기병 #IT자격증 #정보보안
open.kakao.com  앱 개발 및 빅데이터 정보보안 등의 학과는 산업공학보단
컴퓨터공학 및 통신계열의 학과 학위를 졸업해야합니다.
빠른상담 : 010.5676.4159   앱개발자, 웹개발자, 화이트해커, 사이버수사대 등의 진출분야가 있는데
회사는 질문자님이 정하는 것이며 회사에서 요구하는 역량을 채워서
취업을 하는거에요. 
만약 빅데이터 관련으로 가고 싶으면 R 프로그래밍이 가능한 분을
회사에서 찾고 계실 것이고 그에 맞는 교육은 전문교육기관에서
배우고 가시는 게 맞습니다.
추가로 궁금하신 것은 하단의 오픈카톡 이용해주세용 진쌤 1:1 맞춤 교육상담소님의 오픈프로필
#개발자 #엔지니어 #정보보안전문가 #실내인테리어 #무대디자이너 #가구디자이너 #IT자격증 #자바학원 #C언어 #파이썬 #화이트해커 #개발자
open.kakao.com "
2,2,2021-11-13,"안녕하세요 동국대 산업공학과 답변드립니다.
보통 2점 후반에서 3점 후반까지라고 보시면 됩니다.
입시는 절대적인 수치가 아니기에, 편차는 달라질 수 있으며 매년 입시결과는 바뀝니다."
3,2,2021-07-31,"안녕하세요 대진대학교 서포터즈입니다!
산업공학과는 한 학문에 한정되어있지 않고 진출 분야도 다양하기때문에 어떤 활동을 해도 큰 상관이 없습니다!  굳이 추천을 드린다며 산업공학과로  입학시 배우는 전공과목들을 배우는데 있어서 도움이되는 확률과 통계, 데이터분석, 회계관련 책들을 읽으면 도움이 되지 않을까 생각합니다!
현재 산업공학과 지망중이시라면  대진대학교 산업경영공학과도 한번 알아보세요! 
더 궁금한 내용있으시면 언제든지 질문주세요! https://post.naver.com/viewer/postView.nhn?volumeNo=17228869&memberNo=9648774 [학종]'고교생활가이드' 산업공학과 선배가 말해주는 학과/진로 탐색
[BY 오대교수능연구소] [수시전형] 학생부종합전형준비'고교생활가이드' 서울대 선배가 말해주는 학과...
post.naver.com 참고하시기 바라며 현재 내신으로 지원 가능한
선문대 산업경영공학과 소개해드리겠습니다
선문대 산업경영공학과에서는
4차산업혁명 시대에 필요한 공학적 지식과
경영학적 마인드를 갖춘 융합형 인재 양성을 목표로 합니다
* 산업안전기사, 품질경영기사 등의 자격증 취득을 위한 방학 중 무료 자격증 특강 실시
* 신입생의 학습능력을 증진 시키기 위한 자율적 학과 멘토멘티 체계 구축
* 품질, CPIM, 물류로지스피아, 소프트웨어 등 전공 동아리 운영
* SW중심대학, 4차산업혁명 혁신선도대학 등 주요 사업에 참여
IT기술과 생산, 물류, 품질 및 산업 안전 분야에 대한
전문적인 교육을 제공하고 학생들을 위한 교육 환경과
다양한 장학지원 프로그램 등 우수한 교육여건을
보유하고 있는 선문대 산업경영공학과에서 꿈을 펼쳐보세요!
https://youtu.be/5d12PuPTYE0  "
4,2,2021-05-11,"산업공학과가 이과계열에 속해 있어
확통과 미적분이 제일 좋을 거 같습니다.
수능 수학도 미적분 선택지가 제일 많으니 유의하시기 바랍니다.
다만, 대학별로 일부 상이하므로 지원을 원하시는 대학 모집요강을 미리 확인해 보시고, 경제수학 선택여부를 최종결정하시기 바랍니다."
5,2,2021-02-02,"안녕하세요. 해외취업전문가 장흥찬 입니다.
일단 산업공학 전공으로는 미국으로 진행할 수 있는 회사가 너무나 많습니다.
제조업에 품질관리, 생산관리도 가능하고
물류회사도 진행할 수 있습니다.
졸업 후 바로 미국취업 비자(H비자)를 진행하기는 어려우나
J비자를 통행서 미국에서 근무하면서 H비자 및 영주권 스폰을 받아 미국에서 장기체류에 성공할 수 있습니다.
IT계열을 선호한다는 질문이 프로그래머들이 채용이 잘 되는지에 대한 질문이라면
제 답변은 아닙니다.
IT전공자들이 오히려 취업이 더 어려운 경우가 있습니다.
그 이유를 잠깐 설명하면 국내에서 컴퓨터공학 등 IT관련 전공자들이 할 수 있는 프로그래밍 언어는 C언어 및 자바 정도 입니다.
그런데 미국에서는 이것만 해서는 채용이 쉽지 않습니다.
나중에 어떤 업무를 희망하는지 모르겠으나,
미국에서 하고자 하는 업무가 전자공학과 관련있다면 부전공 및 복수전공을 선택하는게 맞습니다.
미국의 경우 비자규정에 의하여 미국에서 담당하는 업무와 관련된 전공자여야하기에
지금하고 있는 전공을 살릴 생각이 없다면 부/복수전공을 통해 학위를 추가로 취득하기를 추천합니다.
궁금한 사항이 있다면 언제든지 문의주세요.
감사합니다.
해외취업전문기업 워크브릿지
www.workbridge.co.kr 해외취업전문기업 워크브릿지
해외취업전문기업 워크브릿지
www.workbridge.co.kr  "
6,2,2021-12-28,"안녕하세요
전북대 IT지능정보공학과가 괜찮아 보입니다.
산업공학과보다는 컴공 계열의 취업률이 높습니다. 산업공학 보다는 it분야가 비전이 좋죠
하지만 비전이 좋다고 방심하면 안되고 그에 맞게 공부도 더 열심히 하셔야 하는데요
입학대비 어떤 공부를 준비해야할지 고민이라면 도와드릴 수 있답니다 코리아IT아카데미 문성현 멘토
- - 상담 신청하기 개인정보처리방침 에 동의 하시겠습니까? Previous Next pused 수강료조회 사전등록 이벤트! 방학특강조회 국비지원 조회 내게맞는과정찾기 051-914-5905 주말·공휴일 상담 및 접수가 가능합니다. 국비개강일정 강남보안 정보시스템 진단분석 전문가 양성C-01.18 개강 신촌자바 스마트콘텐츠 융합 웹 응용프로그래밍 개발자 양성-01.21개강 신촌보안 ICT정보보안(모의해킹) 및 침해사고 대응과정-01.24개강 강남보안 정보시스템 진단분석 전문가 양성C-01.18 개강 신촌자바 스마트콘텐츠 융합 웹 응...
busan-koreaisacademy.net "
7,2,2021-01-18,"산업공학과 관련 과목이니 참고하세요.  교과영역
교과(군)
공통과목
선택과목
일반선택
진로선택
기초
국어
국어
화법과 작문, 독서,
언어와 매체, 문학
  수학
수학
수학Ⅰ, 수학Ⅱ,
미적분, 확률과 통계
기하, 경제 수학
영어
영어
영어Ⅰ, 영어Ⅱ,
영어 독해와 작문
  한국사
한국사
    탐구
사회
(역사, 도덕)
통합사회
사회･문화, 경제
  과학
통합과학
과학탐구실험
물리학Ⅰ, 화학Ⅰ
물리학Ⅱ, 화학Ⅱ, 융합과학
생활
교양
    기술･가정, 정보
공학일반, 창의경영,
지식재산일반 "
8,2,2021-05-28,"대부분 일반사무 부분은 학과제한이 없으니 지원하시고
기술쪽으로는 산업공학과 또는 품질경영기사  채용이 많습니다. 
원하는 분야나 해당 기업채용공고를 정확히 보고 추가 자격이 필요한지 확인한게 좋을 듯합니다.
토익은 경계선에 있는 점수라 좀더 올려야 할 듯합니다."
9,2,2021-05-29,"산업경영공학과는 이과쪽 계열에 속합니다.
학과 이름 중 공학, 공학과로 들어간 명칭의 학과 계열은 공대계열, 이과 계열에 속합니다. 산업공학과(이과)는 확률을 많이 다루는 경영학과라고 보시면 됩니다.  
경영학과(문과)는 기업에 초점을 맞춘 학문입니다. 
경영학과 진학을 진지하게 고려하고 있으시다면 경영학과에서 배우는 과목들과
 경영학과를 졸업한 후 갈 수 있는 다양한 진로에 대해 알아보고
 본인에게 맞는 방향과 뚜렷한 목표를 세우시는 것을 추천합니다. 이 글 읽어보시면 좋겠습니다.
 http://bit.ly/2S9SvLp <유저씨> 경영학과 진로 테크트리 소개
경영학과 진로 테크트리 소개 경영학과에서 배운 내용으로 전문자격증, 금융공기업, 일반기업 등에 도전하고자 한다면 반드시 생각해 봐야 할 사항 총정리! 본 문서의 저작권은 ‘유저씨’에게 있습니다. 무단 도용, 복제 및 사용을 금지하며,  저작권자의 허락없이 무단 사용시에 관계 법령에 의거하여 처벌받을 수 있습니다.  Copyright© yoojussy. All rights reserved.  CONTENTS 들어가며- 경영학과 출신이 주는 시그널은 사실상 없다 I. 경영학과에 가면 뭘 배우는가? 1. 경영학...
bit.ly  안녕하세요 대진대학교 산업경영공학과 서포터즈입니다!
산업공학과와 경영학과는 일단 공과대학과 인문대학에서 이미 차이가 난다고 볼 수 있습니다.
일단 커리큘럼에서의 산업공학과는 공장에서의 관리자를 뜻합니다.
제품에 대한 소요계획, 검사 체계 등 공장에서 필요한 모든 체계를 배우는 것이라 보시면됩니다.
통계학 뿐만 아니라, 컴퓨터 공학, 경영학 등 다양한 학문을 배우는 학과입니다. 
반면에 경영학과는 CEO를 위한, 또는 CEO를 돕기 위한 기본적인 지식등을 배우게 됩니다.
인사, 회계, 재무, 경영, 마케팅 경영 및 회사운영의 틀안에서의 과목은 대부분 배우는 편입니다.
컴퓨터 프로그램 지식을 배운다면 대단히 기초적인 부분을 배우게 됩니다. 
정리하자면 경영학과는 기업의 경영을 잘 하기 위해 도와줄 전문인재를 양성하기 위한 학과 입니다.
 조금이나마 질문자님에게 도움이 되었으면 좋겠습니다!"
10,2,2021-07-20,"안녕하세요! 푸근-하게 답변해주는 햄쌤입니다!
 1. 4년제 대학 3학년 재학중이므로 산업기사를 따면 되는지
- 4년제대학 2학년과정을 이수하셨기때문에
  산업기사 응시는 가능합니다.
2. 화학회사 들어가기 위해 위험물 산업기사를 따면 되는지
- 회사마다 요구하는 자격증들이 다르기때문에 잡코리아 같은 사이트에서
알아보시는것이 좋습니다.
 추가적으로 궁금한점 있으시면
아래 연락처로 문의주세요 푸근-하게 상담해드리겠습니다.
화이팅!!
 연락처 : 010-6433-8643
카카오톡 : gameisfun
실시간 오픈채팅 상담 : https://open.kakao.com/o/s7s4Gsnd ※ 관련학과 : 전문대학 이상의 학교에 개설되어 있는 산업안전, 산업안전시스템
                 화학공업, 화학공학 등
※ 동일직무분야 : 경영 · 회계 · 사무 중 생산관리, 광업자원 중 채광, 기계, 재료
                      섬유 · 의복, 안전관리, 환경 · 에너지 
1. 네 산업기사 획득하시면 됩니다. 제가 생각하기론 지원자격이 될거라고 생각들지만,
   보다 자세한건 Q-net 홈페이지에 들어가셔서 자가진단 해보시는게 가장 정확합니다.
2. 보통 관련이 되있긴 합니다만, 생각해두신 회사가 있으시다면, 그 회사에 대한
   지원공고를 보시는 것이 가장 정확하십니다.
3. 대체복무같은경우, 회사에 따라 다 다르기때문에
   대체복무 인정이 되는 회사에 들어가시면 가능성이 있다고 생각됩니다. 현재 관련학과에 해당이 된다면 2학년 수료기점으로 
응시가 가능해서 지금도 응시자격이 됩니다
또한 관련학과 유무는 큐넷 - 자가진단 통해서 확인이 가능합니다 병역특례 지원시 대학2학년이상 수료한경우는 기능사 안되고 산업기사부터 가능합니다.
위험물 산업기사를 취득해야할지 여부는 지원하고자하는 업체에 문의하시는게 좋을듯합니다.
근데, 대학전공을 살려서 병역특례받으시면 참 좋겠지만, 병역특례랑 전공살리는 별개로 하시는건 어떨까싶네요.
저도 잘 아는건 아니지만, 대게 전기,전자기기, 기계쪽 채용이 아마 화학쪽보다는 훨씬 채용이 많을겁니다.
사실 현역 3순위라 병역특례받기는 매우어려운 조건이긴한데, 
병역특례 채용자체는 화학쪽보다는 전기,전자,기계쪽이 많을겁니다.
일단 현역 3순위면 뭐 거의 어렵다고 봐야할것같습니다.
기본적으로 현역선발은 1,2순위자로만 선발을 일단 실시후 여기서 안뽑고 남는인원 생기면
그 남는 인원가지고 10월달쯤 추가선발을 실시할때 그때에나 3순위자도 지원가능한데, 선발인원도 적고, 
지원자는 여전히 많기때문에 사실상 매우 어렵다고 봐야합니다. 운빨 따라줘야 가능할거에요.
거기다 들리는 얘기로는 내년부터는 아예 현역 3순위자는 선발자체를 않한다는 얘기가 있더라구요.
그게 사실이면 사실상 올해 아니면 기회는 없을겁니다.
 "
11,2,2021-08-30,"너무 배우는게 다른 학과여서 뭐가 나은지 비교할 수 없습니다. 
본인의 능력과 관심에 따라 선택하시는걸 추천드립니다.
수학이나 프로그래밍, 경영학 등에 관심있으면 산업공학
물리, 화학 등 과학 분야에 조금 더 관심있으며 신소재 
번외로 ,두 학과 모두 학벌이 좋은 경우에 괜찮은 학과입니다.
중위권 이하 대학이라면 저 학과들보다는 컴공/전기전자/기계/화공 등 정체성이 뚜렷한 학과들로 가시는게 좋습니다 취업은 산업공학과가 좀 더 잘되는걸로 알아요
대학원까지 생각하면 신소재공학과로 가세요!
참고하시기 바라며 관련 학과로
선문대 산업경영공학과 소개해드릴게요
선문대 산업경영공학과에서는
4차산업혁명 시대에 필요한 공학적 지식과
경영학적 마인드를 갖춘 융합형 인재 양성을 목표로 합니다
* 산업안전기사, 품질경영기사 등의 자격증 취득을 위한 방학 중 무료 자격증 특강 실시
* 신입생의 학습능력을 증진 시키기 위한 자율적 학과 멘토멘티 체계 구축
* 품질, CPIM, 물류로지스피아, 소프트웨어 등 전공 동아리 운영
* SW중심대학, 4차산업혁명 혁신선도대학 등 주요 사업에 참여
IT기술과 생산, 물류, 품질 및 산업 안전 분야에 대한
전문적인 교육을 제공하고 학생들을 위한 교육 환경과
다양한 장학지원 프로그램 등 우수한 교육여건을
보유하고 있는 선문대 산업경영공학과에서 꿈을 펼쳐보세요!
https://youtu.be/GM2UjDS2LQc   두 학과 모두 전망은 괜찮은 편입니다.
산업공학과에서 산업관리자, 보건관리자로
진출한다면 초봉이 높은 편입니다.
산업안전/보건분야에 관심이 있다면
‘유한대학교 지식융합학부의 산업안전학과’로
지원을 생각해보시길 바랍니다.
▶성적반영: 전체 성적 중 최우수 2개 학기
고등학교 1학년~3학년 성적 중에서
최우수 2개 학기의 성적만 반영하여
학기별 성적 편차가 있는 학생들은
더욱 유리하게 지원할 수 있습니다.
▶유한대 산업안전학과는 기업의
안전⦁보건⦁환경을 시스템적으로 관리하고
운영하기 위한 전문관리자를 양성하는 학과입니다.
▶입학 후 최단 기간에 안전관리자 자격 취득 가능,
취업 후 경력을 쌓는 동시에 학사학위 과정으로
4년제 학위까지 취득 가능
▶초봉 3000만~4000만원으로 높은 연봉,
타 직종에 비해 낮은 노동강도로 선호 직종으로
각광받는 안전관리자, 보건관리자로 진출가능  https://pf.kakao.com/_WbJgxb 유한대학교
""마음을 움직이는 단 하나의 선택"" 유한대학교 입학지원센터입니다.
pf.kakao.com  안녕하세요 대진대학교 온라인 서포터즈입니다.
두 학과는 너무 분야가 달라 어느 학과를 추천할 수 없습니다. 취업률은 학교마다 조금의 차이가 있지만 두 학과 모두 높은 취업률을 보여주고 있습니다.
대진대학교에는 다양한 학과가 있으니 아래 링크로 들어오셔서 다양한 학과  교육과정 한번 살펴 보세요.
https://www.daejin.ac.kr/contents/www/cor/hiteng.html 대진대학교 - 휴먼IT공과대학
홈 대학/대학원 대학 휴먼IT공과대학 대학/대학원 대학 대순종학대학 인문예술대학 글로벌산업통상대학 공공인재대학 과학기술대학 휴먼IT공과대학 창의미래인재대학 대학원 학과 편제 휴먼IT공과대학 대진대학교의 휴먼IT공과대학 소개입니다. 전공안내 IT융합학부 학과정보 바로가기 홈페이지 바로가기 전자공학과 학과정보 바로가기 홈페이지 바로가기 에너지공학부 홈페이지 바로가기 환경에너지공학과 학과정보 바로가기 홈페이지 바로가기 기계공학과 학과정보 바로가기 홈페이지 바로가기 신소재공학과 학과정보 바로가기 홈페이지 바로가기 산업경영공학과 학과정보 바...
www.daejin.ac.kr "
12,2,2021-11-01,"제 주변 친구들 보니까 잘 되던데용  부산대학교 입학본부에 오신걸 환영합니다.
Leap forward, PNU! 시대를 열어가는 담대한 지성, 부산대학교 수시모집 수험표 출력(바로가기) 체육교육과 실기고사 자가문진표 작성(바로가기) 체육특기자전형 실기고사 대상자 공고(바로가기) 체육교육과 실기전형 1단계 합격자 공고(바로가...
go.pusan.ac.kr 부산대학교 입학처 링크입니다. 참고를 해보시면 될거 같아요~
대학을 가려고 하시는데에 있어서 
어느 대학을 가야하는지 고민이 되실거에요.
대부분은 성적에 맞춰서 대학을 결정하게 되는데요.
그런데 그 보다 중요한 부분은 자신이 어떤 분야로
흥미를 가지고 있느냐가 중요하다고 할 수 있어요.
자신이 관심있는 분야 및 전공으로 지원을 하셔야
입학을 하고 나서도 후회없는 선택으로 이어질 수 있어요.
현재 전공 선택에 이어서 고민이 되신다면,
광운대학교 정보과학교육원도 좋은 선택이 되실 수 있을거에요. 
사회복지, 게임프로그래밍, 호텔경영, 외식경영, 체육학 등 
14개의 다양한 전공이 개설되어 있기 때문에 선택지가 많아요.
2년에서 2년반이라는 학업 기간으로도 4년제 대졸 학력과
동등한 학력을 인정받을 수 있기에 
시간 단축과 동시에 학력을 만들어보시기 안성맞춤이실거에요.
면접100% 선발을 하고 있어요! (실용음악은 면접+실기포함)
전공 선택이 고민이시라면 
광운대 정보과학교육원을 한번 참고해보시는 것도 좋으실 것 같아요~ [광운대학교]캠퍼스투어 영상
╭╮╭☞ ╭╮ ╭╯ ╰╯ ╭╯ ╰╮ ╭╯ ╰╮ ╰☞ 함 께 보 시 죠 ! ╰( ´◔ ω ◔ `)╯
pf.kakao.com  "
13,2,2021-10-29,"생기부가 잘 구성되어 있다면 합격가능성도 있습니다.
도전해보세요."
14,2,2021-02-18,"물리 선택은 필수는 아니지만 수강하면 도움이 됩니다. 
인간공학분야나 최적화부분에서 물리적인 지식이 있으면 도움이 됩니다. 
물리가 반드시 필요한 공과대학은 기계공학, 전자공학, 신소재공학, 화학공학은 물리가 필요합니다.
오히려 생명공학이 물리와는 거리가 있습니다.
물리를 선택하지 않았다면  수학세특이나 진로활동, 동아리 활동에서 산업공학에 필요한 물리적 원리나 활동을 탐구해 주시면 큰 문제 없을 것 같습니다.
물리가 필요한 순위를 정하면 
기계, 전자, 전기, 신소재, 건축공, 토목공 > 화학공, 환경공> 산업공학> 산업경영공학> 생명공학 
이렇게 생각하시면 될 것 같습니다.
물리 선택 안 했다고 스트레스 받지 마시고 선택한 과목 내신 등급 최대한 올려 주세요..
전공적합성은 다른 방법으로 표현할 수 있습니다.
열심히 공부하고 준비하여 좋은 결과 얻기를 응원합니다.
더 궁금한 내용 있으면 질문 채택 후 1:1 로 질문해 주셔도 됩니다"
15,2,2021-07-22,"경영위에   행정이라는 말이 있듯이
행정은   개설한대학이 많지 않기에
취업은 큰 걱정 않하는 학과 입니다.
공무원 보다 대기업에 인사행정으로
취업 많이  하고  보건행정으로  대형병원으로
소방행정으로 소방청으로도  진입 할수
있습니다.
행정학만으로 먹차기에 복수전공
꿈도 꾸지 마세요!"
16,2,2021-08-15,"안녕하세요.
과학고/카이스트/서울대 대학원 출신으로 
실제 서류/면접 심사관 들어가는 임원입니다.
(카카오톡[돋보기/찾기기능]에서 자소서로 검색하면 제 로고 바로 나옵니다.)
---------------------------------
음..
제가 얼마전에 본인과 비슷한 분을
국내 탑클래스인 N사... 에 합격시켜드렸는데
나이랑 학벌, 학점이 거의 비슷하십니다. 
그분이 오히려 학점이 낮았던 것 같아요.
다만 그 분은 SW엔지니어라서 직무가 특정되어 있지만
본인은 그렇지 않지요
지금 27살이시니 좀 있으면 28됩니다. 
솔직하게 저라면 직종, 기업 따질 상황이 아닌 것 같아서 
(사실 일반 사무직부터 다 가능한 학과잖아요)
산업안전기사나 사무자동화산업기사 보유자를 조금이라도 쳐 주는 곳에 
다 넣을 것 같습니다.
지금은 선택해서 가려고 할 때가 아니라
어디든 들어간 후에,
전열?을 재정비해서 이직하실 생각을 하셔야 합니다.
지금 1년 놓치면 취업 정말 어려워지니 열심히 해보세요~!
궁금하신 사항이 있는 경우 아래 링크로 오시면 진지하게 대화 가능합니다.
제게 서비스 의뢰 같은 것 안하셔도 
문의 가능하십니다.
----------------------------------
크몽, 재능아지트, 오투잡 등에서 국내 최고수준 5점 만점 후기 총 1000개 이상 있습니다.
추가 도움 필요시 하단 링크 누르셔서 요청하시면 KAIST 출신 임원이 정성껏 상담해 드립니다.
http://pf.kakao.com/_wVtds 인생을 바꾸는 합격 자소서
억대연봉 서울대 카이스트 출신 임원이 합격시켜드립니다
pf.kakao.com "
17,2,2021-10-23,"건국대 산업공학과 지난해 입결이니 참고하세요.   대입정보포털 어디가 www.adiga.kr 사이트에서 전년도 입시결과를 확인하는 방법이니 참고하세요. 
 대입정보포털 어디가 www.adiga.kr > [대학/학과/전형정보] > [학과정보] 메뉴에서 대학명과 학과명으로 검색하여 [입시결과]를 바로 확인할 수 있습니다. (로그인 필수)
  수시컨설팅 가격이 넘 비싸서 좀 고민됐었는데 거북스쿨은 싸고 괜찮더라구요 한번 들어가보세요"
